{
  "schema_version": "m4a-1",
  "acceptance_id": "pocky_m5a1_s1_press",
  "notes": "S1 slow button press diagnostics, thresholds copied from s0_acceptance.json where analogous. The press is 200 constant-force phases of 10 ms ramping the button actuator 0 to -25 N (negative presses, -X), then 1.0 s at -25 N, a 0.5 s zero-input release and a 1.5 s final hold. rod_full_stroke passes when the rod displacement is within [-24.5, -21.939] mm, i.e. at least 95% of the 23.094 mm stroke (the stop is at -23.194 mm). body_drop_total_* are signed world-z changes since the initial pose (S0 bound +/-0.1 mm); body_drop_extra_* are since the end of settle. window=max_over_phase covers only the named to_phase, so the press is sampled at its last ramp phase press_199 and the pressed hold. contact_duration is whole-run (it includes settle), so it is not a press-only metric. 0.2 mm peak penetration is the numerical validity bound, never a physical FAIL.",
  "near_threshold_fraction": 0.2,
  "checks": [
    {
      "name": "rod_full_stroke",
      "kind": "joint_displacement",
      "joint": "rod_x",
      "to_phase": "press_hold",
      "expected": -0.02321965,
      "tolerance": 0.00128035,
      "units": "m"
    },
    {
      "name": "rod_returned",
      "kind": "return_displacement",
      "joint": "rod_x",
      "phase": "final_hold",
      "reference": 0.0,
      "max": 0.0002,
      "units": "m"
    },
    {
      "name": "body_drop_total_press_end",
      "kind": "relative_translation",
      "body_a": "chassis",
      "body_b": "body",
      "from_phase": "initial",
      "to_phase": "press_199",
      "axis": "z",
      "frame": "world",
      "lower": -0.0001,
      "upper": 0.0001,
      "window": "max_over_phase",
      "units": "m"
    },
    {
      "name": "body_drop_total_press_hold",
      "kind": "relative_translation",
      "body_a": "chassis",
      "body_b": "body",
      "from_phase": "initial",
      "to_phase": "press_hold",
      "axis": "z",
      "frame": "world",
      "lower": -0.0001,
      "upper": 0.0001,
      "window": "max_over_phase",
      "units": "m"
    },
    {
      "name": "body_drop_extra_press_hold",
      "kind": "relative_translation",
      "body_a": "chassis",
      "body_b": "body",
      "from_phase": "settle",
      "to_phase": "press_hold",
      "axis": "z",
      "frame": "world",
      "lower": -0.0001,
      "upper": 0.0001,
      "window": "max_over_phase",
      "units": "m"
    },
    {
      "name": "body_drop_total_final",
      "kind": "relative_translation",
      "body_a": "chassis",
      "body_b": "body",
      "from_phase": "initial",
      "to_phase": "final_hold",
      "axis": "z",
      "frame": "world",
      "lower": -0.0001,
      "upper": 0.0001,
      "window": "max_over_phase",
      "units": "m"
    },
    {
      "name": "body_drop_extra_final",
      "kind": "relative_translation",
      "body_a": "chassis",
      "body_b": "body",
      "from_phase": "settle",
      "to_phase": "final_hold",
      "axis": "z",
      "frame": "world",
      "lower": -0.0001,
      "upper": 0.0001,
      "window": "max_over_phase",
      "units": "m"
    },
    {
      "name": "body_pose_press_hold",
      "kind": "relative_pose",
      "body_a": "body",
      "body_b": "chassis",
      "phase": "press_hold",
      "window": "max_over_phase",
      "max": 0.0002,
      "max_rotation_rad": 0.003490658503988659,
      "units": "m"
    },
    {
      "name": "body_pose_final_hold",
      "kind": "relative_pose",
      "body_a": "body",
      "body_b": "chassis",
      "phase": "final_hold",
      "window": "max_over_phase",
      "max": 0.0002,
      "max_rotation_rad": 0.003490658503988659,
      "units": "m"
    },
    {
      "name": "body_on_pusher",
      "kind": "contact_duration",
      "body_a": "body",
      "body_b": "pusher",
      "force_threshold_n": 0.0715,
      "max": 0.2,
      "units": "s"
    },
    {
      "name": "body_on_rod",
      "kind": "contact_duration",
      "body_a": "body",
      "body_b": "rod",
      "force_threshold_n": 0.0715,
      "max": 0.2,
      "units": "s"
    },
    {
      "name": "body_on_crank",
      "kind": "contact_duration",
      "body_a": "body",
      "body_b": "crank",
      "force_threshold_n": 0.0715,
      "max": 0.2,
      "units": "s"
    },
    {
      "name": "settled_body",
      "kind": "body_speed",
      "body": "body",
      "phase": "final_hold",
      "window": "max_over_phase",
      "max": 0.001,
      "units": "m/s"
    },
    {
      "name": "effort_bound",
      "kind": "effort_bound",
      "actuator": "button",
      "max": 25.0,
      "units": "N"
    },
    {
      "name": "penetration",
      "kind": "penetration_bound",
      "max": 0.0002,
      "units": "m"
    }
  ],
  "validity": {
    "max_penetration_m": 0.0002
  }
}
