{
  "schema_version": "m4a-1",
  "acceptance_id": "pocky_dispense_v1",
  "notes": "Headless dispense PASS/FAIL: the packet must exit the body and be presented, and the housing must not move. Events packet_exit and packet_presentation and checks exactly_one_packet and pickup_ready are copied verbatim from the frozen acceptance.toml (raw SHA256 518a45ffc4592ca602be4c33c59681038e43dedaa15b688312202c3a57ff6ca2). Housing thresholds (body/chassis relative pose, signed world-z body drop, body contact_duration on pusher/rod/crank, penetration validity) are copied from s0_acceptance.json (raw SHA256 150c037b2e985dac46b66670c46291872d9e0cc9d287d7946eadf4d9185b5a3a); pose and drop are checked with window=max_over_phase in each of actuate, press_hold, release and hold. Expected to FAIL on the current prototype.",
  "events": [
    {
      "name": "packet_exit",
      "kind": "exit_crossing",
      "bodies": [
        "packet"
      ],
      "object_half_extents_m": [
        0.0825,
        0.0275,
        0.0026
      ],
      "window_from": "actuate",
      "window_to": "hold",
      "plane": {
        "point_m": [
          0.088,
          0.0,
          0.0
        ],
        "normal": [
          1.0,
          0.0,
          0.0
        ],
        "direction": 1
      }
    },
    {
      "name": "packet_presentation",
      "kind": "supported_presentation",
      "bodies": [
        "packet"
      ],
      "object_half_extents_m": [
        0.0825,
        0.0275,
        0.0026
      ],
      "window_from": "actuate",
      "window_to": "hold",
      "release_phase": "release",
      "dwell_from": "release",
      "dwell_to": "hold",
      "min_protrusion_m": 0.03,
      "target_protrusion_m": 0.04,
      "min_accessible_m": 0.01,
      "dwell_min_s": 0.5,
      "protrusion_change_max_m": 0.001,
      "support_bodies": [
        "lip",
        "body"
      ],
      "min_support_load_fraction": 0.6,
      "support_hull_margin_m": 0.001,
      "support_hull_min_area_m2": 1e-05,
      "support_degeneracy_radius_m": 0.002,
      "max_terminal_speed_m_s": 0.01,
      "fallout_drop_m": 0.02,
      "plane": {
        "point_m": [
          0.088,
          0.0,
          0.0
        ],
        "normal": [
          1.0,
          0.0,
          0.0
        ],
        "direction": 1
      },
      "access_plane": {
        "point_m": [
          0.106,
          0.0,
          0.0
        ],
        "normal": [
          1.0,
          0.0,
          0.0
        ],
        "direction": 1
      },
      "bounds_m": {
        "x": [
          -0.1,
          0.25
        ],
        "y": [
          -0.1,
          0.1
        ],
        "z": [
          -0.03,
          0.08
        ]
      }
    }
  ],
  "checks": [
    {
      "name": "exactly_one_packet",
      "kind": "event_count",
      "event": "packet_exit",
      "expected": 1,
      "tolerance": 0,
      "units": "count"
    },
    {
      "name": "pickup_ready",
      "kind": "event_verdict",
      "event": "packet_presentation",
      "units": "state"
    },
    {
      "name": "body_pose_retained_actuate",
      "kind": "relative_pose",
      "body_a": "body",
      "body_b": "chassis",
      "phase": "actuate",
      "window": "max_over_phase",
      "max": 0.0002,
      "max_rotation_rad": 0.003490658503988659,
      "units": "m"
    },
    {
      "name": "body_drop_actuate",
      "kind": "relative_translation",
      "body_a": "chassis",
      "body_b": "body",
      "from_phase": "initial",
      "to_phase": "actuate",
      "axis": "z",
      "frame": "world",
      "lower": -0.0001,
      "upper": 0.0001,
      "window": "max_over_phase",
      "units": "m"
    },
    {
      "name": "body_pose_retained_press_hold",
      "kind": "relative_pose",
      "body_a": "body",
      "body_b": "chassis",
      "phase": "press_hold",
      "window": "max_over_phase",
      "max": 0.0002,
      "max_rotation_rad": 0.003490658503988659,
      "units": "m"
    },
    {
      "name": "body_drop_press_hold",
      "kind": "relative_translation",
      "body_a": "chassis",
      "body_b": "body",
      "from_phase": "initial",
      "to_phase": "press_hold",
      "axis": "z",
      "frame": "world",
      "lower": -0.0001,
      "upper": 0.0001,
      "window": "max_over_phase",
      "units": "m"
    },
    {
      "name": "body_pose_retained_release",
      "kind": "relative_pose",
      "body_a": "body",
      "body_b": "chassis",
      "phase": "release",
      "window": "max_over_phase",
      "max": 0.0002,
      "max_rotation_rad": 0.003490658503988659,
      "units": "m"
    },
    {
      "name": "body_drop_release",
      "kind": "relative_translation",
      "body_a": "chassis",
      "body_b": "body",
      "from_phase": "initial",
      "to_phase": "release",
      "axis": "z",
      "frame": "world",
      "lower": -0.0001,
      "upper": 0.0001,
      "window": "max_over_phase",
      "units": "m"
    },
    {
      "name": "body_pose_retained_hold",
      "kind": "relative_pose",
      "body_a": "body",
      "body_b": "chassis",
      "phase": "hold",
      "window": "max_over_phase",
      "max": 0.0002,
      "max_rotation_rad": 0.003490658503988659,
      "units": "m"
    },
    {
      "name": "body_drop_hold",
      "kind": "relative_translation",
      "body_a": "chassis",
      "body_b": "body",
      "from_phase": "initial",
      "to_phase": "hold",
      "axis": "z",
      "frame": "world",
      "lower": -0.0001,
      "upper": 0.0001,
      "window": "max_over_phase",
      "units": "m"
    },
    {
      "name": "body_on_pusher",
      "kind": "contact_duration",
      "body_a": "body",
      "body_b": "pusher",
      "force_threshold_n": 0.0715,
      "max": 0.2,
      "units": "s"
    },
    {
      "name": "body_on_rod",
      "kind": "contact_duration",
      "body_a": "body",
      "body_b": "rod",
      "force_threshold_n": 0.0715,
      "max": 0.2,
      "units": "s"
    },
    {
      "name": "body_on_crank",
      "kind": "contact_duration",
      "body_a": "body",
      "body_b": "crank",
      "force_threshold_n": 0.0715,
      "max": 0.2,
      "units": "s"
    },
    {
      "name": "penetration",
      "kind": "penetration_bound",
      "max": 0.0002,
      "units": "m"
    }
  ],
  "validity": {
    "max_penetration_m": 0.0002
  }
}
